{
  "$schema": "https://json-schema.org/draft/2020-12/schema",
  "$id": "https://gallery-of-saints/schema/saint.schema.json",
  "title": "Saint",
  "description": "One saint as one entity with N per-church attestations. There is no merged row and no single truth: a figure venerated by one church and refused by another carries both, side by side, unresolved.",
  "type": "object",
  "required": ["slug", "display_name", "attestations"],
  "additionalProperties": false,
  "properties": {
    "slug": {
      "type": "string",
      "pattern": "^[a-z0-9]+(-[a-z0-9]+)*$",
      "description": "Permanent id. Must equal the folder name."
    },
    "aliases": {
      "$comment": "Written only by a merge (2026-10-03, TODO item 13): two folders that held one saint become one, and the slug that was folded away is recorded here so its URL does not die. `views/saint.js` redirects an alias to the slug it names. Not a place for spellings or transliterations - those are `names`.",
      "type": "array",
      "uniqueItems": true,
      "items": { "type": "string", "pattern": "^[a-z0-9]+(-[a-z0-9]+)*$" },
      "description": "Slugs this folder used to be. May not be any folder's slug, nor another folder's alias."
    },
    "display_name": {
      "$comment": "The bare name, and only the name (author, 2026-08-27). It used to hold name, office, rank and death year in one string - \"Gorazd, Bishop of Bohemia and Moravia-Silesia, Hieromartyr (1942)\" - which is why the site could only ever prefix \"St.\": any other honorific would have collided with a rank already sitting in the string. The rank is read from `types`, the office is the field below, and the year is in `dates.death`; none of the three belongs here.",
      "type": "string",
      "minLength": 1
    },
    "office": {
      "$comment": "What the figure held, not what they are called: \"Presbyter\", \"Bishop of Sardis\", \"Metropolitan of Moschonisia\". Printed on the subtext line beside the dates, never in the name - the rank is short and is how a saint is named, the office is long and is a fact about them, so the long half goes on the line that can truncate without losing the identity.",
      "type": "string",
      "minLength": 1
    },
    "kind": {
      "$comment": "A folder is a saint unless it says otherwise. The one alternative is a feast: when the Great Feasts become folders, \"St. Dormition of the Theotokos\" is what a blanket honorific would print, so the naming function opts out on this flag rather than on a guess about the name (STRUCTURE.md, the naming contract). Nothing in the corpus carries it yet; it is here before the work that needs it, not after.",
      "enum": ["saint", "feast"]
    },
    "names": { "type": "array", "items": { "$ref": "#/$defs/name" } },
    "sex": { "enum": ["male", "female", "unknown"] },
    "types": { "type": "array", "items": { "type": "string", "minLength": 1 } },
    "dates": { "$ref": "#/$defs/dates" },
    "attestations": {
      "type": "array",
      "minItems": 1,
      "items": { "$ref": "#/$defs/attestation" }
    },
    "locations": { "type": "array", "items": { "$ref": "#/$defs/location" } },
    "track": {
      "description": "An ordered journey with years on it: where the sources place this person, and from when until when. Separate from `locations`, which is an unordered set of kinds carrying no dates at all — a bishop's see and a saint's relics are facts about a life, not moments in it. The map reads this to move the dot as the timeline crosses the life; without it a saint has one dot chosen by year, which is all the corpus can honestly say about almost everyone.",
      "type": "array",
      "minItems": 2,
      "items": { "$ref": "#/$defs/waypoint" }
    },
    "historicity": { "enum": ["attested", "traditional", "disputed", "legendary"] },
    "related": {
      "type": "array",
      "items": { "type": "string", "pattern": "^[a-z0-9]+(-[a-z0-9]+)*$" }
    },
    "text": {
      "type": "object",
      "additionalProperties": false,
      "properties": {
        "life": { "type": "string" },
        "sources": { "type": "array", "items": { "type": "string" } }
      }
    },
    "images": { "type": "array", "items": { "$ref": "#/$defs/image" } },
    "hymns": {
      "$comment": "The troparion and kontakion a church sings for the figure, in that church's own language, copied whole from the cited source with the tone it prints (author, 2026-08-22). A hymn belongs to a church, as an attestation does: the Greek apolytikion and the Romanian tropar are different texts, not translations of one.",
      "type": "array",
      "items": {
        "type": "object",
        "required": ["church", "kind", "lang", "text", "source"],
        "additionalProperties": false,
        "properties": {
          "church": { "type": "string", "minLength": 1 },
          "kind": { "enum": ["troparion", "kontakion"] },
          "lang": { "type": "string", "minLength": 2 },
          "tone": { "type": "string" },
          "model": { "$comment": "The automelon the hymn is sung to, where the source names it.", "type": "string" },
          "text": { "type": "string", "minLength": 1 },
          "source": { "$ref": "#/$defs/source" },
          "english": {
            "$comment": "An English rendering of this same hymn — never a different church's hymn, which the Greek apolytikion and the Romanian tropar are to one another. It arrives one of two ways and has to say which. `source` is somebody else's published rendering, copied with its citation: Orloff's General Menaion (1899) and Hapgood's Service Book (1906) are the two used, both long in the public domain, and a modern translation is a living author's work needing their permission. `rendered: \"site\"` is this site's own rendering of the text beside it — which the corpus's no-invention rule forbade from 2026-08-22 until the author reversed it for hymns alone on 2026-09-07. It is a field rather than a silence because a reader must be able to tell a citation from a translation made here, and the saint page prints the difference. Exactly one of the two, never both and never neither.",
            "type": "object",
            "required": ["text"],
            "additionalProperties": false,
            "properties": {
              "text": { "type": "string", "minLength": 1 },
              "source": { "$ref": "#/$defs/source" },
              "rendered": {
                "$comment": "Who rendered it. Present only where this site did.",
                "enum": ["site"]
              }
            },
            "oneOf": [
              { "required": ["source"], "not": { "required": ["rendered"] } },
              { "required": ["rendered"], "not": { "required": ["source"] } }
            ]
          }
        }
      }
    }
  },

  "$defs": {
    "name": {
      "type": "object",
      "required": ["form"],
      "additionalProperties": false,
      "properties": {
        "form": { "type": "string", "minLength": 1 },
        "lang": { "type": "string", "minLength": 2 },
        "note": { "type": "string" }
      }
    },

    "interval": {
      "description": "Every date is an interval. A precise date has equal bounds. A null bound is an open bound — a real finding, such as 'no later than 550' — and is not the same as an absent date.",
      "type": ["object", "null"],
      "required": ["basis"],
      "additionalProperties": false,
      "properties": {
        "earliest": { "type": ["integer", "null"] },
        "latest": { "type": ["integer", "null"] },
        "display": { "type": ["string", "null"] },
        "basis": { "enum": ["attested", "traditional", "inferred", "unknown"] },
        "note": { "type": "string" }
      }
    },

    "dates": {
      "type": "object",
      "additionalProperties": false,
      "properties": {
        "birth": { "$ref": "#/$defs/interval" },
        "death": { "$ref": "#/$defs/interval" },
        "floruit": { "$ref": "#/$defs/interval" }
      }
    },

    "source": {
      "type": "object",
      "required": ["text"],
      "additionalProperties": false,
      "properties": {
        "text": { "type": "string", "minLength": 1 },
        "year": { "type": "integer" },
        "url": { "type": "string", "format": "uri" },
        "note": { "type": "string" }
      }
    },

    "feast": {
      "oneOf": [
        {
          "type": "object",
          "required": ["day", "month", "calendar"],
          "additionalProperties": false,
          "properties": {
            "day": { "type": "integer", "minimum": 1, "maximum": 31 },
            "month": { "type": "integer", "minimum": 1, "maximum": 12 },
            "calendar": { "enum": ["gregorian", "julian", "revised-julian"] },
            "note": { "type": "string" }
          }
        },
        {
          "description": "Movable feast, as a signed day offset from Pascha. The computus is taken from the church unless stated here.",
          "type": "object",
          "required": ["calendar", "offset"],
          "additionalProperties": false,
          "properties": {
            "calendar": { "const": "paschal" },
            "offset": { "type": "integer", "minimum": -200, "maximum": 200 },
            "computus": { "enum": ["gregorian", "julian"] },
            "note": { "type": "string" }
          }
        }
      ]
    },

    "attestation": {
      "type": "object",
      "required": ["church", "status"],
      "additionalProperties": false,
      "properties": {
        "church": { "type": "string", "minLength": 1 },
        "status": { "enum": ["venerated", "not-venerated", "undocumented"] },
        "feast": { "$ref": "#/$defs/feast" },
        "titles": { "type": "array", "items": { "type": "string" } },
        "rank": {
          "$comment": "The typikon's rank of the service this church keeps for the figure, where the source states it — vigil, polyeleos, great doxology, six stichera, or a simple service. It is what the red-letter idiom is for in this tradition, and it is a sourced editorial datum, not an inference from a date.",
          "enum": ["vigil", "polyeleos", "great-doxology", "six-stichera", "simple"]
        },
        "source": { "$ref": "#/$defs/source" },
        "note": { "type": "string" }
      },
      "allOf": [
        {
          "$comment": "A veneration and a refusal are both positive findings and both need a citation. Only 'undocumented' — we have not looked, or looked and found nothing — may stand without one, which is exactly what makes it different from a refusal.",
          "if": {
            "required": ["status"],
            "properties": { "status": { "enum": ["venerated", "not-venerated"] } }
          },
          "then": { "required": ["source"] }
        },
        {
          "$comment": "A feast day is a claim about veneration and cannot be attached to a refusal or a gap.",
          "if": {
            "required": ["status"],
            "properties": { "status": { "enum": ["not-venerated", "undocumented"] } }
          },
          "then": { "not": { "required": ["feast"] } }
        }
      ]
    },

    "location": {
      "type": "object",
      "required": ["kind"],
      "additionalProperties": false,
      "dependentRequired": {
        "lat": ["lon", "uncertainty_km"],
        "lon": ["lat"],
        "uncertainty_km": ["lat"]
      },
      "properties": {
        "kind": { "enum": ["birth", "death", "ministry", "relics", "see"] },
        "historical_name": { "type": "string" },
        "modern_name": { "type": "string" },
        "lat": { "type": "number", "minimum": -90, "maximum": 90 },
        "lon": { "type": "number", "minimum": -180, "maximum": 180 },
        "uncertainty_km": {
          "description": "Radius of uncertainty in kilometres — a number, not an enum, so halos, cluster thresholds and label logic are one continuous function of one field (Addendum B1). Authoring defaults: pinpointed site 1, city 15, region 150, 'somewhere in this province' 500. Required whenever coordinates are present.",
          "type": "number",
          "exclusiveMinimum": 0,
          "maximum": 20000
        },
        "note": { "type": "string" }
      }
    },

    "waypoint": {
      "description": "One stay on a `track`. `from` and `to` are the years the sources place the person here; a null `from` on the first stay means 'from birth, the year unrecorded' and a null `to` on the last means 'until death'. Between one stay's `to` and the next's `from` the map draws the dot moving, which is the one thing on a track that is drawn rather than sourced — where someone travelled between two attested places is almost never recorded, and the `note` on each stay is where that is said in words.",
      "type": "object",
      "required": ["lat", "lon", "uncertainty_km"],
      "additionalProperties": false,
      "properties": {
        "place": { "type": "string" },
        "from": { "type": ["integer", "null"] },
        "to": { "type": ["integer", "null"] },
        "lat": { "type": "number", "minimum": -90, "maximum": 90 },
        "lon": { "type": "number", "minimum": -180, "maximum": 180 },
        "uncertainty_km": { "type": "number", "exclusiveMinimum": 0, "maximum": 20000 },
        "note": { "type": "string" }
      }
    },

    "image": {
      "type": "object",
      "required": ["file"],
      "additionalProperties": false,
      "properties": {
        "file": { "type": "string", "minLength": 1 },
        "meta": { "type": "string" }
      }
    }
  }
}
