{
  "slug": "julian-companion-of-pamphilus",
  "display_name": "Julian, companion of Pamphilus",
  "sex": "male",
  "types": [
    "martyr"
  ],
  "names": [
    {
      "form": "Ιουλιανός",
      "lang": "el",
      "note": "Read out of saint.gr's page for the company listed on 16 Φεβρουαρίου as «Άγιος Πάμφιλος και οι συν αυτώ Μάρτυρες», which names its twelve one by one; the rank word is left off. The page glosses the name, from Ιούλιος, as the glorious one, like Julius Caesar."
    }
  ],
  "related": [
    "pamphilus-of-caesarea",
    "valens-the-deacon",
    "paul-of-jamnia",
    "seleucus-of-cappadocia",
    "porphyrius-servant-of-pamphilus"
  ],
  "dates": {
    "death": {
      "earliest": 284,
      "latest": 305,
      "display": "284–305",
      "basis": "traditional",
      "note": "saint.gr for the company: «Οι Άγιοι Μάρτυρες Πάμφιλος, Δανιήλ, Hλίας, Ησαΐας, Θεόδουλος, Ιερεμίας, Ιουλιανός, Ουάλης, Παύλος, Πορφύριος, Σαμουήλ και Σέλευκος, μαρτύρησαν επί αυτοκράτορα Διοκλητιανού (284 - 305 μ.Χ.).» The page gives the reign and no year within it."
    }
  },
  "attestations": [
    {
      "church": "russian",
      "status": "undocumented",
      "note": "Not checked: days.pravoslavie.ru for the corresponding Julian day (30 September 2026)."
    },
    {
      "church": "romanian",
      "status": "undocumented",
      "note": "Not checked: doxologia.ro's calendar for the same civil day (30 September 2026)."
    },
    {
      "church": "greek",
      "status": "venerated",
      "feast": {
        "day": 16,
        "month": 2,
        "calendar": "revised-julian"
      },
      "source": {
        "text": "saint.gr, το εορτολόγιο της 16ης Φεβρουαρίου — «Άγιος Πάμφιλος και οι συν αυτώ Μάρτυρες»",
        "url": "https://www.saint.gr/02/16/index.aspx",
        "year": 2026
      }
    },
    {
      "church": "serbian",
      "status": "undocumented",
      "note": "Not checked: the Ohrid Prologue on pravoslavno.rs for the corresponding Julian day (30 September 2026)."
    }
  ],
  "text": {
    "life": "life.md"
  }
}
