{
  "slug": "socrates-companion-of-theodote",
  "display_name": "Socrates, companion of Theodote",
  "sex": "male",
  "types": [
    "presbyter",
    "martyr"
  ],
  "names": [
    {
      "form": "Σωκράτης",
      "lang": "el",
      "note": "Read out of saint.gr's line for 21 Οκτωβρίου, «Αγία Θεοδότη και ο Άγιος Σωκράτης ο Πρεσβύτερος», with the rank words left off."
    }
  ],
  "dates": {
    "death": {
      "earliest": 201,
      "latest": 300,
      "display": "3rd century",
      "basis": "traditional",
      "note": "saint.gr: «Η Αγία Θεοδότη και ο Άγιος Σωκράτης ο Πρεσβύτερος έζησαν τον 3ο αιώνα μ.Χ., όταν βασιλιάς ήταν ο Αλέξανδρος ο Σεβήρος, και μαρτύρησαν στην Άγκυρα» — the page gives the century and the reign and no year."
    }
  },
  "attestations": [
    {
      "church": "russian",
      "status": "undocumented",
      "note": "Not checked: days.pravoslavie.ru for the corresponding Julian day (1 October 2026)."
    },
    {
      "church": "romanian",
      "status": "undocumented",
      "note": "Not checked: doxologia.ro's calendar for the same civil day (1 October 2026)."
    },
    {
      "church": "greek",
      "status": "venerated",
      "feast": {
        "day": 21,
        "month": 10,
        "calendar": "revised-julian"
      },
      "source": {
        "text": "saint.gr, το εορτολόγιο της 21ης Οκτωβρίου — «Αγία Θεοδότη και ο Άγιος Σωκράτης ο Πρεσβύτερος»",
        "url": "https://www.saint.gr/10/21/index.aspx",
        "year": 2026
      },
      "note": "The life page `https://www.saint.gr/2558/saint.aspx` heads «Τύπος εορτής: Σταθερή. Εορτάζει στις 21 Οκτωβρίου εκάστου έτους», the same day as the listing. Two further entries on this day may be this man under another spelling and are both refused: «Άγιος Ευκράτης ο Οσιομάρτυρας» (`https://www.saint.gr/2557/saint.aspx`), of whom the page says «Ίσως να πρόκειται για τον Άγιο Σωκράτη που εορτάζει την ίδια ημέρα και κατά την αντιγραφή, από λάθος, να έγινε Εύκρατης», and «Άγιος Σωκράτης ο ιερομάρτυρας» (`https://www.saint.gr/2552/saint.aspx`), which carries the asterisk and says «Πουθενά άλλου δεν αναφέρεται η μνήμη του αυτή τη μέρα. Ίσως είναι ο ίδιος με τον Άγιο Σωκράτη, που εορτάζεται μαζί με την αγία Θεοδότη την ίδια ημέρα». Ancyra is named without a year and no coordinate is proposed. No asterisk and no «Δεν είναι διασταυρωμένη» sentence on the life page."
    },
    {
      "church": "serbian",
      "status": "undocumented",
      "note": "Not checked: the Ohrid Prologue as printed by pravoslavno.rs for the corresponding Julian day (1 October 2026)."
    }
  ],
  "related": [
    "theodote-of-nicaea"
  ],
  "text": {
    "life": "life.md"
  }
}
